{
  "$schema": "http://json-schema.org/draft-07/schema#",
  "$id": "http://agentsoc.local/schemas/security_event.json",
  "title": "SecurityEvent",
  "type": "object",
  "required": [
    "event_id",
    "timestamp",
    "source",
    "event_type",
    "severity",
    "raw_data"
  ],
  "properties": {
    "event_id": {
      "type": "string",
      "description": "Unique identifier for the security event"
    },
    "timestamp": {
      "type": "string",
      "format": "date-time",
      "description": "ISO 8601 timestamp of when the event occurred"
    },
    "source": {
      "type": "string",
      "description": "Log source or sensor (e.g. auth.log, edr, firewall)"
    },
    "event_type": {
      "type": "string",
      "description": "Type of event (e.g. authentication_failure, process_creation, outbound_connection)"
    },
    "severity": {
      "type": "string",
      "enum": ["LOW", "MEDIUM", "HIGH", "CRITICAL"]
    },
    "host": {
      "type": "string",
      "description": "Hostname or IP of affected system"
    },
    "user": {
      "type": "string",
      "description": "Username associated with the event"
    },
    "ip_address": {
      "type": "string",
      "description": "Source or destination IP address"
    },
    "raw_data": {
      "type": "object",
      "description": "Raw unparsed or semi-structured event payload"
    }
  },
  "additionalProperties": false
}
